{
	"$id": "https://github.com/kjanat/svg/blob/master/npm/targets.schema.json",
	"$schema": "https://json-schema.org/draft/2020-12/schema",
	"$defs": {
		"bundle": {
			"description": "Meta-package that installs every facade at once via exact-pinned \"dependencies\" and re-exposes all their bins.",
			"type": "object",
			"required": [
				"name",
				"template"
			],
			"properties": {
				"description": {
					"description": "npm package.json description for the bundle.",
					"type": "string",
					"minLength": 1
				},
				"name": {
					"description": "npm package name of the bundle.",
					"type": "string",
					"pattern": "^(@[a-z0-9][a-z0-9-]*/)?[a-z0-9][a-z0-9._-]*$"
				},
				"template": {
					"description": "Template directory under \"distribution/npm/facade/\".",
					"type": "string",
					"pattern": "^[a-z0-9][a-z0-9._-]*$"
				}
			},
			"additionalProperties": false
		},
		"facade": {
			"description": "A user-facing npm package exposing one binary. \nEach facade has its own per-platform sub-packages (\"<scope>/<pkg>-<target.pkg>\", one binary each) via \"optionalDependencies\".",
			"type": "object",
			"required": [
				"bin",
				"name",
				"pkg"
			],
			"properties": {
				"alsoPublishAs": {
					"description": "Additional npm names this facade is published under, byte-identical apart from \"name\" (e.g. a scoped twin of an unscoped facade).",
					"type": "array",
					"minItems": 1,
					"uniqueItems": true,
					"items": {
						"type": "string",
						"pattern": "^(@[a-z0-9][a-z0-9-]*/)?[a-z0-9][a-z0-9._-]*$"
					}
				},
				"bin": {
					"description": "Binary this facade launches. Must be listed in \"binaries\".",
					"type": "string",
					"pattern": "^[a-zA-Z0-9_-]+$"
				},
				"description": {
					"description": "npm package.json description for this facade.",
					"type": "string",
					"minLength": 1
				},
				"name": {
					"description": "npm package name users install. Unscoped or scoped.",
					"type": "string",
					"pattern": "^(@[a-z0-9][a-z0-9-]*/)?[a-z0-9][a-z0-9._-]*$"
				},
				"pkg": {
					"description": "Tool prefix for this facade's platform sub-packages: \"<scope>/<pkg>-<target.pkg>\".",
					"type": "string",
					"pattern": "^[a-z0-9][a-z0-9-]*$"
				},
				"shim": {
					"description": "Unscoped alias package published alongside this facade: a thin package whose exact-pinned dependency and bin shims defer to the canonical (scoped) facade, so installs count on both names.",
					"type": "string",
					"pattern": "^[a-z0-9][a-z0-9._-]*$"
				},
				"template": {
					"description": "Template directory under \"distribution/npm/facade/\". Defaults to \"name\"; required when \"name\" is scoped (a \"/\" cannot appear in a directory name).",
					"type": "string",
					"pattern": "^[a-z0-9][a-z0-9._-]*$"
				}
			},
			"additionalProperties": false
		},
		"target": {
			"description": "Build target for a specific platform/configuration. \nUsed to generate release tarballs and platform-specific sub-packages.",
			"type": "object",
			"required": [
				"build",
				"cpu",
				"os",
				"pkg",
				"runner",
				"rust",
				"tier"
			],
			"properties": {
				"build": {
					"description": "- \"cargo\" for native compilation on a matching runner; \n- \"cross\" for cross-compilation via the \"cross\" crate (typically Linux → { Linux, *BSD }); \n- \"cargo-cross-toolchain\" for stable cross-compilation via taiki-e/setup-cross-toolchain-action (Linux → tier-2/3 targets with prebuilt std); \n- \"cargo-build-std\" for tier-3 cross-compilation via setup-cross-toolchain-action + nightly + -Z build-std; \n- \"vm\" for builds that run inside a target-OS VM and bypass the standard build-and-upload matrix.",
					"type": "string",
					"enum": [
						"cargo",
						"cross",
						"cargo-cross-toolchain",
						"cargo-build-std",
						"vm"
					]
				},
				"cpu": {
					"description": "npm \"cpu\" field — values from Node's \"process.arch\".",
					"type": "array",
					"minItems": 1,
					"uniqueItems": true,
					"items": {
						"type": "string",
						"enum": [
							"arm",
							"arm64",
							"ia32",
							"loong64",
							"mips",
							"mipsel",
							"ppc64",
							"riscv64",
							"s390",
							"s390x",
							"x64"
						]
					}
				},
				"experimental": {
					"description": "Used by the release workflow as \"continue-on-error\". Only valid on tier-3 targets.",
					"default": false,
					"type": "boolean"
				},
				"libc": {
					"description": "npm \"libc\" field — only meaningful on Linux. \nDistinguishes glibc and musl builds so the right sub-package is installed on Alpine etc.",
					"type": "array",
					"minItems": 1,
					"uniqueItems": true,
					"items": {
						"type": "string",
						"enum": [
							"glibc",
							"musl"
						]
					}
				},
				"os": {
					"description": "npm \"os\" field — values from Node's \"process.platform\". \nnpm uses this to select the correct \"optionalDependency\" at install time.",
					"type": "array",
					"minItems": 1,
					"uniqueItems": true,
					"items": {
						"type": "string",
						"enum": [
							"aix",
							"darwin",
							"freebsd",
							"linux",
							"netbsd",
							"openbsd",
							"sunos",
							"win32"
						]
					}
				},
				"pkg": {
					"description": "Platform identifier. Final package names are \"<scope>/<facade.pkg>-<pkg>\", one per facade.",
					"type": "string",
					"pattern": "^[a-z0-9][a-z0-9-]*$"
				},
				"runner": {
					"description": "Hosted/self-hosted runner labels.",
					"examples": [
						"ubuntu-latest",
						"macos-latest",
						"macos-15-intel",
						"windows-latest",
						"windows-11-arm"
					],
					"type": "string",
					"minLength": 1
				},
				"runtime": {
					"description": "Required runtime smoke environment. Omit for build-only targets; configured checks must pass before publication.",
					"type": "object",
					"required": [
						"runner"
					],
					"properties": {
						"container": {
							"type": "string",
							"pattern": "^node:[0-9]+-alpine$"
						},
						"runner": {
							"type": "string",
							"minLength": 1
						}
					},
					"additionalProperties": false
				},
				"rust": {
					"description": "Passed to \"cargo build --target\" / \"cross build --target\". \nAlso used to locate the release tarball: \"svg-<tag>-<rust>.tar.gz\".",
					"type": "string",
					"pattern": "^[a-z0-9_]+(-[a-z0-9_]+){2,3}$"
				},
				"tier": {
					"description": "1 = first-class (release-blocking), \n2 = best-effort, \n3 = experimental (failures don't block release).",
					"type": "integer",
					"enum": [
						1,
						2,
						3
					]
				}
			},
			"additionalProperties": false,
			"dependentSchemas": {
				"libc": {
					"description": "libc is only meaningful on Linux. If declared, os must include linux.",
					"required": [
						"os"
					],
					"properties": {
						"os": {
							"type": "array",
							"contains": {
								"const": "linux"
							}
						}
					}
				}
			},
			"allOf": [
				{
					"if": {
						"required": [
							"os"
						],
						"properties": {
							"os": {
								"type": "array",
								"contains": {
									"const": "linux"
								}
							}
						}
					},
					"then": {
						"description": "Linux targets must declare libc to disambiguate glibc and musl builds at install time.",
						"required": [
							"libc"
						]
					}
				},
				{
					"if": {
						"required": [
							"experimental"
						],
						"properties": {
							"experimental": {
								"const": true
							}
						}
					},
					"then": {
						"description": "Only tier-3 targets may be marked experimental.",
						"properties": {
							"runtime": false,
							"tier": {
								"const": 3
							}
						}
					}
				}
			]
		}
	},
	"title": "svg npm targets matrix",
	"description": "Build matrix for the svg facades and their shared per-platform optionalDependencies. Consumed by npm/scripts/build-packages.ts and the release workflow.",
	"type": "object",
	"required": [
		"binaries",
		"facades",
		"scope",
		"targets"
	],
	"properties": {
		"$schema": {
			"type": "string"
		},
		"binaries": {
			"description": "Binary names extracted from each release tarball and shipped in every platform sub-package's \"bin/\" directory. \nOn Windows, \".exe\" is appended automatically.",
			"type": "array",
			"minItems": 1,
			"uniqueItems": true,
			"items": {
				"type": "string",
				"pattern": "^[a-zA-Z0-9_-]+$"
			}
		},
		"bundle": {
			"$ref": "#/$defs/bundle"
		},
		"facades": {
			"description": "User-facing npm packages, one per binary. \nEach resolves to the correct platform sub-package via \"optionalDependencies\".",
			"type": "array",
			"minItems": 1,
			"items": {
				"$ref": "#/$defs/facade"
			}
		},
		"grammars": {
			"description": "Tree-sitter grammar node packages published to npm from \"grammars/<name>/\" at the release tag, version stamped from the tag and Bun \"catalog:\" references resolved at publish.",
			"type": "array",
			"minItems": 1,
			"uniqueItems": true,
			"items": {
				"type": "string",
				"pattern": "^[a-z0-9][a-z0-9-]*$"
			}
		},
		"scope": {
			"description": "npm scope under which platform sub-packages are published. \nEach sub-package is published as \"<scope>/<pkg>\". Must be a scope the publishing npm account owns.",
			"type": "string",
			"pattern": "^@[a-z0-9][a-z0-9-]*$"
		},
		"targets": {
			"description": "Per-platform build targets. One entry per published sub-package.",
			"type": "array",
			"minItems": 1,
			"items": {
				"$ref": "#/$defs/target"
			}
		}
	},
	"additionalProperties": false
}
